{
  "packet_type": "council_request",
  "date": "2026-02-11",
  "time_of_day": "morning",
  "available_min": 15,
  "energy": 2,
  "mood": 2,
  "stall_flag": false,
  "recent_events": [
    {
      "type": "workshop",
      "ref_id": "workshop_walk_001",
      "branch_id": "branch_walk",
      "duration_min": 15,
      "metrics": {
        "joy": 2,
        "strain": 1
      },
      "note": "写真3枚で気分戻った"
    }
  ],
  "armory_cards": [
    {
      "card_id": "card_R1",
      "label": "回復",
      "duration_min": 7
    },
    {
      "card_id": "card_C2",
      "label": "継続",
      "duration_min": 15
    },
    {
      "card_id": "card_Z1",
      "label": "閉じ",
      "duration_min": 7
    }
  ],
  "rules": {
    "max_recommendations": 3,
    "execute_max": 1,
    "autopick": "A"
  }
}